{
  "schemaVersion": "0.1.0",
  "kind": "geck-placement-evidence",
  "game": "falloutnv",
  "captureMethod": "human-geck-inspection",
  "geckProviderSha256": "53ffdbf57b32352938afa292b87dac5044f92b784c083513d549beeffc2b330b",
  "cell": {
    "resolutionId": "io.fixture.cell",
    "kind": "cell",
    "editorId": "SyntheticExterior",
    "formId": "00000001",
    "signature": "CELL"
  },
  "position": { "x": 1, "y": 2, "z": 3 },
  "rotation": { "x": 0, "y": 0, "z": 90 },
  "operatorStatement": "Synthetic contract values were deliberately reviewed for fixture testing only; they do not identify a real game cell or prove GECK or provider compatibility.",
  "attestation": {
    "suitabilityHumanReviewed": true,
    "forgeObservedGeck": false,
    "providerCompatibilityProven": false,
    "pluginSavedDuringCapture": false,
    "verificationPerformed": false
  },
  "limitations": [
    "operator-attested-not-machine-observed",
    "placement-suitability-not-independently-verified",
    "provider-compatibility-not-proven",
    "plugin-not-saved-or-verified"
  ]
}
